{
  "AdMarkers": "example-value",
  "Id": "id-abc123",
  "IncludeIframeOnlyStream": "example-value",
  "ManifestName": "example-resource",
  "PlaylistType": "STANDARD",
  "PlaylistWindowSeconds": "example-value",
  "ProgramDateTimeIntervalSeconds": "example-value",
  "Url": "example-value",
  "AdTriggers": "example-value",
  "AdsOnDeliveryRestrictions": "example-value"
}